{
  "$schema": "http://json-schema.org/draft-07/schema#",
  "$id": "change.schema.json",
  "title": "Change Manifest",
  "description": "One file per unit of work at specs/changes/<slug>.change.json. A change is the primary unit of work; areas/contracts remain the logical spec boundary. The manifest holds membership only — which targets, which IDs. Per-target phase status (checked/applied/verified) is NEVER stored here: it is derived mechanically from the area JSONs (witness model_sha freshness, check_results.ran_at vs last_modified, traceability, verification_log) so it cannot go stale. Committed with the PR; status 'landed' on merge makes it a changelog entry. Deleting every manifest leaves the specs complete.",
  "type": "object",
  "required": ["change", "intent", "status", "targets"],
  "additionalProperties": false,
  "properties": {
    "$schema": { "type": "string" },
    "change": {
      "type": "string",
      "pattern": "^[a-z0-9][a-z0-9-]*$",
      "description": "Slug. Doubles as the suggested branch name (change/<slug>) and commit scope (spec(<slug>): ...)."
    },
    "intent": {
      "type": "string",
      "description": "One sentence: what this change accomplishes, in domain terms."
    },
    "status": {
      "enum": ["open", "in-progress", "landed", "abandoned"],
      "description": "open = created, no spec edits yet; in-progress = edits underway; landed = PR merged; abandoned = dropped without landing."
    },
    "created": { "type": "string", "format": "date" },
    "last_modified": { "type": "string", "format": "date" },
    "branch": {
      "type": "string",
      "description": "Git branch carrying the change, if one was created."
    },
    "targets": {
      "type": "array",
      "description": "Every area/contract spec this change touches. Contracts spanning a touched area are auto-added (auto: true). Membership and IDs only — phase status is derived from the area JSONs, never stored.",
      "items": {
        "type": "object",
        "required": ["name"],
        "additionalProperties": false,
        "properties": {
          "name": { "type": "string", "description": "Area slug — specs/<name>.intent.json must exist." },
          "kind": { "enum": ["area", "contract"] },
          "auto": {
            "type": "boolean",
            "description": "true when pulled in automatically (contract cascade) rather than edited explicitly."
          },
          "ids": {
            "type": "array",
            "items": { "type": "string" },
            "description": "IDs added or modified in this target by this change — any ID the area declares (REQ/UI, INV, PROP, CON, DEC, Q, ASM, EX). References only — content lives in the area JSON."
          }
        }
      }
    },
    "open_questions": {
      "type": "array",
      "items": { "type": "string" },
      "description": "Cross-target question refs in <area>/Q-NNN form, blocking this change."
    },
    "notes": { "type": "string" }
  }
}
